{
  "schemaVersion": "1.0",
  "changeId": "automotive-speed-warning",
  "nodes": [
    {
      "id": "FB-001",
      "type": "feature",
      "title": "Speed warning",
      "artifact": "examples/automotive-speed-warning/feature-brief.md",
      "anchor": "FB-001",
      "status": "proposed"
    },
    {
      "id": "SRC-001",
      "type": "source",
      "title": "Configurable speed limit (km/h)",
      "artifact": "examples/automotive-speed-warning/source-register.md",
      "anchor": "SRC-001",
      "scope": "in-scope",
      "status": "proposed"
    },
    {
      "id": "SRC-002",
      "type": "source",
      "title": "Audible and visual warning on exceedance",
      "artifact": "examples/automotive-speed-warning/source-register.md",
      "anchor": "SRC-002",
      "scope": "in-scope",
      "status": "proposed"
    },
    {
      "id": "FR-001",
      "type": "feature-requirement",
      "title": "Configured speed limit warning",
      "artifact": "examples/automotive-speed-warning/feature-spec.md",
      "anchor": "FR-001",
      "status": "proposed"
    },
    {
      "id": "AC-001",
      "type": "acceptance-criterion",
      "title": "Verify approved exceedance behavior",
      "artifact": "examples/automotive-speed-warning/feature-spec.md",
      "anchor": "AC-001",
      "status": "proposed"
    },
    {
      "id": "SYS-001",
      "type": "system-requirement",
      "title": "Evaluate approved overspeed condition",
      "artifact": "examples/automotive-speed-warning/system-requirements.md",
      "anchor": "SYS-001",
      "status": "blocked"
    },
    {
      "id": "SYS-002",
      "type": "system-requirement",
      "title": "Request approved audible and visual outputs",
      "artifact": "examples/automotive-speed-warning/system-requirements.md",
      "anchor": "SYS-002",
      "status": "blocked"
    },
    {
      "id": "ARCH-001",
      "type": "architecture-element",
      "title": "Overspeed condition evaluation",
      "artifact": "examples/automotive-speed-warning/architecture.md",
      "anchor": "ARCH-001",
      "status": "proposed"
    },
    {
      "id": "ARCH-002",
      "type": "architecture-element",
      "title": "Audible/visual output boundary",
      "artifact": "examples/automotive-speed-warning/architecture.md",
      "anchor": "ARCH-002",
      "status": "proposed"
    },
    {
      "id": "SWE-001",
      "type": "software-requirement",
      "title": "Implement approved exceedance condition",
      "artifact": "examples/automotive-speed-warning/software-requirements.md",
      "anchor": "SWE-001",
      "status": "blocked"
    },
    {
      "id": "SWE-002",
      "type": "software-requirement",
      "title": "Issue approved output requests",
      "artifact": "examples/automotive-speed-warning/software-requirements.md",
      "anchor": "SWE-002",
      "status": "blocked"
    },
    {
      "id": "T-004",
      "type": "task",
      "title": "Implement approved vertical slice",
      "artifact": "examples/automotive-speed-warning/tasks.md",
      "anchor": "T-004",
      "status": "proposed"
    },
    {
      "id": "T-005",
      "type": "task",
      "title": "Add and execute tests",
      "artifact": "examples/automotive-speed-warning/tasks.md",
      "anchor": "T-005",
      "status": "proposed"
    },
    {
      "id": "TC-001",
      "type": "test-case",
      "title": "Verify overspeed condition",
      "artifact": "examples/automotive-speed-warning/verification.md",
      "anchor": "TC-001",
      "status": "blocked"
    },
    {
      "id": "TC-002",
      "type": "test-case",
      "title": "Verify audible/visual requests",
      "artifact": "examples/automotive-speed-warning/verification.md",
      "anchor": "TC-002",
      "status": "blocked"
    }
  ],
  "edges": [
    {
      "id": "TR-001",
      "source": "SRC-001",
      "target": "FR-001",
      "type": "derives",
      "status": "proposed",
      "evidence": [
        {
          "artifact": "examples/automotive-speed-warning/source-register.md",
          "anchor": "SRC-001",
          "note": "Speed-limit configuration intent from the example source register."
        }
      ]
    },
    {
      "id": "TR-002",
      "source": "SRC-002",
      "target": "FR-001",
      "type": "derives",
      "status": "proposed",
      "evidence": [
        {
          "artifact": "examples/automotive-speed-warning/source-register.md",
          "anchor": "SRC-002",
          "note": "Audible/visual warning intent; detailed behavior is deliberately unresolved."
        }
      ]
    },
    {
      "id": "TR-003",
      "source": "FB-001",
      "target": "FR-001",
      "type": "decomposes-into",
      "status": "proposed",
      "evidence": [
        {
          "artifact": "examples/automotive-speed-warning/feature-brief.md",
          "anchor": "FB-001",
          "note": "Feature intent decomposed into the observable warning scenario."
        }
      ]
    },
    {
      "id": "TR-004",
      "source": "FR-001",
      "target": "AC-001",
      "type": "has-acceptance-criteria",
      "status": "proposed",
      "evidence": [
        {
          "artifact": "examples/automotive-speed-warning/feature-spec.md",
          "anchor": "AC-001",
          "note": "Acceptance criterion attached to FR-001."
        }
      ]
    },
    {
      "id": "TR-005",
      "source": "AC-001",
      "target": "SYS-001",
      "type": "derives",
      "status": "proposed",
      "evidence": [
        {
          "artifact": "examples/automotive-speed-warning/system-requirements.md",
          "anchor": "SYS-001",
          "note": "System requirement proposed from the feature acceptance criterion."
        }
      ]
    },
    {
      "id": "TR-006",
      "source": "AC-001",
      "target": "SYS-002",
      "type": "derives",
      "status": "proposed",
      "evidence": [
        {
          "artifact": "examples/automotive-speed-warning/system-requirements.md",
          "anchor": "SYS-002",
          "note": "System requirement proposed from the feature acceptance criterion."
        }
      ]
    },
    {
      "id": "TR-007",
      "source": "SYS-001",
      "target": "ARCH-001",
      "type": "allocated-to",
      "status": "proposed",
      "evidence": [
        {
          "artifact": "examples/automotive-speed-warning/architecture.md",
          "anchor": "ARCH-001",
          "note": "Illustrative allocation; component ownership awaits project evidence."
        }
      ]
    },
    {
      "id": "TR-008",
      "source": "SYS-002",
      "target": "ARCH-002",
      "type": "allocated-to",
      "status": "proposed",
      "evidence": [
        {
          "artifact": "examples/automotive-speed-warning/architecture.md",
          "anchor": "ARCH-002",
          "note": "Illustrative allocation; interface contract awaits project evidence."
        }
      ]
    },
    {
      "id": "TR-009",
      "source": "SYS-001",
      "target": "SWE-001",
      "type": "allocated-to",
      "status": "proposed",
      "evidence": [
        {
          "artifact": "examples/automotive-speed-warning/software-requirements.md",
          "anchor": "SWE-001",
          "note": "Illustrative software allocation; blocked on product decisions."
        }
      ]
    },
    {
      "id": "TR-010",
      "source": "SYS-002",
      "target": "SWE-002",
      "type": "allocated-to",
      "status": "proposed",
      "evidence": [
        {
          "artifact": "examples/automotive-speed-warning/software-requirements.md",
          "anchor": "SWE-002",
          "note": "Illustrative software allocation; blocked on interface confirmation."
        }
      ]
    },
    {
      "id": "TR-011",
      "source": "SWE-001",
      "target": "T-004",
      "type": "implemented-by",
      "status": "proposed",
      "evidence": [
        {
          "artifact": "examples/automotive-speed-warning/tasks.md",
          "anchor": "T-004",
          "note": "Planned task; implementation has not been performed."
        }
      ]
    },
    {
      "id": "TR-012",
      "source": "SWE-002",
      "target": "T-005",
      "type": "implemented-by",
      "status": "proposed",
      "evidence": [
        {
          "artifact": "examples/automotive-speed-warning/tasks.md",
          "anchor": "T-005",
          "note": "Planned task; implementation/testing evidence does not yet exist."
        }
      ]
    },
    {
      "id": "TR-013",
      "source": "SWE-001",
      "target": "TC-001",
      "type": "verified-by",
      "status": "proposed",
      "evidence": [
        {
          "artifact": "examples/automotive-speed-warning/verification.md",
          "anchor": "TC-001",
          "note": "Planned test; not executed."
        }
      ]
    },
    {
      "id": "TR-014",
      "source": "SWE-002",
      "target": "TC-002",
      "type": "verified-by",
      "status": "proposed",
      "evidence": [
        {
          "artifact": "examples/automotive-speed-warning/verification.md",
          "anchor": "TC-002",
          "note": "Planned test; not executed."
        }
      ]
    }
  ]
}
